{
  "schema_version": "gridplan.v1",
  "assets": [
    {
      "id": "82d51b71-1c16-5ada-912d-8f9f234dc604",
      "external_ref": "",
      "code": "EQ-001",
      "name": "Asset 1",
      "asset_class": "switchgear",
      "voltage_level": "",
      "location_code": "LOC-1",
      "parent_asset_id": null,
      "service_area": "",
      "coordinates": null,
      "risk": {
        "probability_of_failure": 0.14,
        "consequence_score": 0.336,
        "criticality": "low",
        "assessment_timestamp": null,
        "assessment_method": "synthetic_proxy",
        "confidence": 0.0,
        "source_ref": "",
        "is_advisory": true
      },
      "failure_modes": [],
      "data_provenance": "synthetic",
      "domain_attributes": {}
    },
    {
      "id": "bcb43106-5056-588f-9459-d34d4143ea02",
      "external_ref": "",
      "code": "EQ-002",
      "name": "Asset 2",
      "asset_class": "line",
      "voltage_level": "",
      "location_code": "LOC-2",
      "parent_asset_id": null,
      "service_area": "",
      "coordinates": null,
      "risk": {
        "probability_of_failure": 0.13,
        "consequence_score": 0.28800000000000003,
        "criticality": "medium",
        "assessment_timestamp": null,
        "assessment_method": "synthetic_proxy",
        "confidence": 0.0,
        "source_ref": "",
        "is_advisory": true
      },
      "failure_modes": [],
      "data_provenance": "synthetic",
      "domain_attributes": {}
    },
    {
      "id": "520755f9-5499-5d9f-9b07-2c89510225b3",
      "external_ref": "",
      "code": "EQ-003",
      "name": "Asset 3",
      "asset_class": "line",
      "voltage_level": "",
      "location_code": "LOC-3",
      "parent_asset_id": null,
      "service_area": "",
      "coordinates": null,
      "risk": {
        "probability_of_failure": 0.32,
        "consequence_score": 0.752,
        "criticality": "high",
        "assessment_timestamp": null,
        "assessment_method": "synthetic_proxy",
        "confidence": 0.0,
        "source_ref": "",
        "is_advisory": true
      },
      "failure_modes": [],
      "data_provenance": "synthetic",
      "domain_attributes": {}
    },
    {
      "id": "fd3f52ad-6713-5852-89ad-a2ff8c295b2f",
      "external_ref": "",
      "code": "EQ-004",
      "name": "Asset 4",
      "asset_class": "switchgear",
      "voltage_level": "",
      "location_code": "LOC-4",
      "parent_asset_id": null,
      "service_area": "",
      "coordinates": null,
      "risk": {
        "probability_of_failure": 0.05,
        "consequence_score": 0.8320000000000001,
        "criticality": "critical",
        "assessment_timestamp": null,
        "assessment_method": "synthetic_proxy",
        "confidence": 0.0,
        "source_ref": "",
        "is_advisory": true
      },
      "failure_modes": [],
      "data_provenance": "synthetic",
      "domain_attributes": {}
    },
    {
      "id": "14534136-5dcc-5e40-984d-c55c8d005cb3",
      "external_ref": "",
      "code": "EQ-005",
      "name": "Asset 5",
      "asset_class": "line",
      "voltage_level": "",
      "location_code": "LOC-5",
      "parent_asset_id": null,
      "service_area": "",
      "coordinates": null,
      "risk": {
        "probability_of_failure": 0.08,
        "consequence_score": 0.528,
        "criticality": "low",
        "assessment_timestamp": null,
        "assessment_method": "synthetic_proxy",
        "confidence": 0.0,
        "source_ref": "",
        "is_advisory": true
      },
      "failure_modes": [],
      "data_provenance": "synthetic",
      "domain_attributes": {}
    },
    {
      "id": "f4fb1f19-29e0-5744-86a1-394f2c9abd83",
      "external_ref": "",
      "code": "EQ-006",
      "name": "Asset 6",
      "asset_class": "line",
      "voltage_level": "",
      "location_code": "LOC-6",
      "parent_asset_id": null,
      "service_area": "",
      "coordinates": null,
      "risk": {
        "probability_of_failure": 0.22999999999999998,
        "consequence_score": 0.48,
        "criticality": "medium",
        "assessment_timestamp": null,
        "assessment_method": "synthetic_proxy",
        "confidence": 0.0,
        "source_ref": "",
        "is_advisory": true
      },
      "failure_modes": [],
      "data_provenance": "synthetic",
      "domain_attributes": {}
    },
    {
      "id": "15f51431-54a9-5f61-b99d-7d21d0c09f58",
      "external_ref": "",
      "code": "EQ-007",
      "name": "Asset 7",
      "asset_class": "switchgear",
      "voltage_level": "",
      "location_code": "LOC-7",
      "parent_asset_id": null,
      "service_area": "",
      "coordinates": null,
      "risk": {
        "probability_of_failure": 0.24,
        "consequence_score": 0.56,
        "criticality": "high",
        "assessment_timestamp": null,
        "assessment_method": "synthetic_proxy",
        "confidence": 0.0,
        "source_ref": "",
        "is_advisory": true
      },
      "failure_modes": [],
      "data_provenance": "synthetic",
      "domain_attributes": {}
    },
    {
      "id": "e6123e4c-f480-56d7-bb2c-6459498319ac",
      "external_ref": "",
      "code": "EQ-008",
      "name": "Asset 8",
      "asset_class": "line",
      "voltage_level": "",
      "location_code": "LOC-8",
      "parent_asset_id": null,
      "service_area": "",
      "coordinates": null,
      "risk": {
        "probability_of_failure": 0.22999999999999998,
        "consequence_score": 0.768,
        "criticality": "critical",
        "assessment_timestamp": null,
        "assessment_method": "synthetic_proxy",
        "confidence": 0.0,
        "source_ref": "",
        "is_advisory": true
      },
      "failure_modes": [],
      "data_provenance": "synthetic",
      "domain_attributes": {}
    },
    {
      "id": "59158c42-9f72-5631-b00f-1a31b0fdeafd",
      "external_ref": "",
      "code": "EQ-009",
      "name": "Asset 9",
      "asset_class": "line",
      "voltage_level": "",
      "location_code": "LOC-9",
      "parent_asset_id": null,
      "service_area": "",
      "coordinates": null,
      "risk": {
        "probability_of_failure": 0.24,
        "consequence_score": 0.20800000000000002,
        "criticality": "low",
        "assessment_timestamp": null,
        "assessment_method": "synthetic_proxy",
        "confidence": 0.0,
        "source_ref": "",
        "is_advisory": true
      },
      "failure_modes": [],
      "data_provenance": "synthetic",
      "domain_attributes": {}
    },
    {
      "id": "de62984c-76eb-52c2-a12a-e1caaad18846",
      "external_ref": "",
      "code": "EQ-010",
      "name": "Asset 10",
      "asset_class": "switchgear",
      "voltage_level": "",
      "location_code": "LOC-10",
      "parent_asset_id": null,
      "service_area": "",
      "coordinates": null,
      "risk": {
        "probability_of_failure": 0.19,
        "consequence_score": 0.6719999999999999,
        "criticality": "medium",
        "assessment_timestamp": null,
        "assessment_method": "synthetic_proxy",
        "confidence": 0.0,
        "source_ref": "",
        "is_advisory": true
      },
      "failure_modes": [],
      "data_provenance": "synthetic",
      "domain_attributes": {}
    },
    {
      "id": "94f7dfb5-000a-5037-9cfb-c7112b71f128",
      "external_ref": "",
      "code": "EQ-011",
      "name": "Asset 11",
      "asset_class": "line",
      "voltage_level": "",
      "location_code": "LOC-11",
      "parent_asset_id": null,
      "service_area": "",
      "coordinates": null,
      "risk": {
        "probability_of_failure": 0.22000000000000003,
        "consequence_score": 0.6240000000000001,
        "criticality": "high",
        "assessment_timestamp": null,
        "assessment_method": "synthetic_proxy",
        "confidence": 0.0,
        "source_ref": "",
        "is_advisory": true
      },
      "failure_modes": [],
      "data_provenance": "synthetic",
      "domain_attributes": {}
    },
    {
      "id": "785ec03e-c04c-5462-9edc-80e22104a301",
      "external_ref": "",
      "code": "EQ-012",
      "name": "Asset 12",
      "asset_class": "line",
      "voltage_level": "",
      "location_code": "LOC-12",
      "parent_asset_id": null,
      "service_area": "",
      "coordinates": null,
      "risk": {
        "probability_of_failure": 0.11,
        "consequence_score": 0.32,
        "criticality": "critical",
        "assessment_timestamp": null,
        "assessment_method": "synthetic_proxy",
        "confidence": 0.0,
        "source_ref": "",
        "is_advisory": true
      },
      "failure_modes": [],
      "data_provenance": "synthetic",
      "domain_attributes": {}
    }
  ],
  "crews": [
    {
      "id": "c39b45b5-1627-527f-9a13-e3a76aedc23c",
      "code": "CREW-01",
      "qualifications": [
        "electro",
        "relay"
      ],
      "max_parallel": 1,
      "home_location_code": "DEPOT-1",
      "shift_calendar": [],
      "service_area": "",
      "availability": [],
      "data_provenance": "synthetic",
      "domain_attributes": {}
    },
    {
      "id": "b35dc4e1-2f0c-5e43-82e2-a45b7ba99f14",
      "code": "CREW-02",
      "qualifications": [
        "relay",
        "line"
      ],
      "max_parallel": 1,
      "home_location_code": "DEPOT-2",
      "shift_calendar": [],
      "service_area": "",
      "availability": [],
      "data_provenance": "synthetic",
      "domain_attributes": {}
    },
    {
      "id": "97318489-b8b2-5962-b1ad-16f9c2e9abdb",
      "code": "CREW-03",
      "qualifications": [
        "line",
        "switchgear"
      ],
      "max_parallel": 1,
      "home_location_code": "DEPOT-3",
      "shift_calendar": [],
      "service_area": "",
      "availability": [],
      "data_provenance": "synthetic",
      "domain_attributes": {}
    },
    {
      "id": "dd2db9fd-eba8-5986-843d-eb16ecb8388c",
      "code": "CREW-04",
      "qualifications": [
        "switchgear",
        "electro"
      ],
      "max_parallel": 1,